직무ID,직무,회사,주요업무,자격요건,우대사항,혜택 및 복지,채용보상금
156370,[주니어] 재무회계 담당자(부산),페이타랩(패스오더),"['"" 충원이 아닌, 사세 확장에 따른 신규 포지션 채용이에요! “', '', '【 페이타랩 재무회계팀 】', '', '재무회계팀은 회사의 자금이 효율적으로 운영될 수 있도록 관리하고 건강한 재무 상태를 유지하여 회사가 안정적으로 목표에 도달할 수 있도록 지원하는 팀이에요. 회계 및 세무적인 이슈에 대한 리스크 관리를 통해 재무 정보의 신뢰성과 투명성을 유지할 수 있도록 노력해요.', '', '재무회계 담당자는 다양한 내부 구성원들과의 긴밀한 소통과 협업을 통해 최선의 의사결정을 할 수 있도록 유용한 정보를 제공하는 역할을 맡고 있기 때문에 폭넓은 전문 지식과 경험을 가진 사람들이 모여있어요.', '', '', '', '【 오시면 이런 업무를 하게 되실 거예요! 】', '', '매출 세금계산서 발행, 매출마감 및 결산, 가맹점 정산업무를 진행해요.', '주요자금 입/출금 거래내역 확인 및 회계 처리를 진행해요.', '전사 법인카드 운영 및 관리를 진행해요.', '재무제표 및 회계 관련 보고서를 작성해요.', '자금 흐름을 관리하고 회계 기준에 따른 비즈니스별 계정을 운영해요.', '', '', '', '【 이런 경험이 있다면 꼭 알려주세요! 】', '', '재무회계 업무 경험에 대한 자세한 설명이나 구체적인 자료가 포함된 포트폴리오 또는 경력기술서를 제출해 주세요.', '주도적으로 재무회계 업무를 진행한 경험 또는 세무 이슈를 파악하여 선제적으로 대응한 경험이 있다 면 알려주세요.', '재무회계 담당자로서 어떤 생각과 가치관을 갖고 계시는지 궁금해요.']","['【 이런 분을 찾고 있어요! 】', '', '스타트업 또는 IT 기업에서 재무/자금/회계 실무를 1년 이상 수행하신 분', '기본적인 회계 및 세무 지식을 갖추고 계신 분', '회계처리 검토 및 이를 위한 시스템 운영 (ERP 등)이 가능하신 분']","['【 이런 분이면 더 좋아요! 】', '', 'IT 또는 비대면 결제 시장 및 O2O 서비스의 이해도가 높은 분', '스타트업, 플랫폼 업종의 정산 및 회계 업무에 대한 이해도가 있으신 분', '다양한 유관 부서와 유연하게 커뮤니케이션이 가능한 분']","['【 저희는 이렇게 일해요! 】', '', ""1. 그냥 하는 일은 없어요. 스스로 업무를 할 때 '왜?'를 항상 생각해요."", '2. 완벽한 결과물은 없다고 생각해요. 빠르게 실행해 보고 아니면 개선해 나가요.', '3. 하나의 팀으로 연결되어 있어요. 사내의 모든 정보는 투명하게 공유하고 있어요.', '4. 스포츠팀처럼 일해요. 각자의 포지션에서 최고가 되기 위해 끊임없이 성장해요.', '5. 개인의 성장을 지지해요. 누구나 원하는 만큼 성장할 수 있도록 회사가 지원을 아끼지 않아요.', '6. 직책 및 연차와 상관없이 모든 구성원이 자유롭게 소통하고 대단하게 피드백을 주고받아요.', '7. 관계는 수평적이에요. 직급 대신 ‘님’이라는 호칭을 사용하고, 상호 존칭을 사용하며 서로를 존중해요.', '8. 업무는 수직적으로 해요. 책임을 지는 의사 결정권자와 실무자의 구분을 명확히 해요.', '9. 구성원들을 진심으로 아끼고 배려해요. 일은 힘들 수 있지만, 사람 때문에 힘든 일은 없어요.', '10. 저녁 회식이 없어요. 다음 날 최상의 컨디션으로 일할 수 있도록 회사가 방해하지 않아요.', '', '', '', '【 당신의 성장을 적극적으로 지원해요! 】', '', '오직 일과 성장에만 몰입하고 집중할 수 있도록', '', '업무 효율을 낼 수 있는 최고 스펙 장비 제공', '┕ 맥북프로, LG 그램 (2-3년 주기 업그레이드)', '27” 듀얼모니터 제공', '쾌적한 업무 환경 제공 (스타일러, 가습기, IQ Air 공기청정기)', '키보드, 마우스 등 필요한 주변기기 맞춤 제공', '개인별 법인카드 지급 (식대, 출장 등에 사용)', '사유를 묻지 않는 자유로운 연차 사용', '', '원하는 만큼 배우고, 성장할 수 있도록', '', '교육비 무제한 전액 지원', '세미나, 컨퍼런스 참여 비용 무제한 지원', '20개 이상 교육 또는 온라인 콘텐츠 구독', '도서 무제한 구입 지원', 'Chat GPT 4.0 지원', '업무에 필요한 다양한 툴 적극 지원', '', '함께하는 구성원이 행복할 수 있도록', '', '법인카드 식대 지원(식대 1만 1천원)', '패스오더 포인트 매월 지급 (50,000P)', '에스프레소 머신, Tea 무제한 제공', '간식(스낵바) 무제한 제공', '종합건강검진 지원', '명절 백화점 상품권 지급', '생일 축하 백화점 상품권 지급', '구성원 경조사 발생 시 근조화환 및 경조 휴가, 경조금 지원', '', '', '', '【 이런 여정을 거치게 되실 거예요! 】', '', '⎸서류전형 ＞ 사전 테스트(필요 시 생략) ＞ 1차 인터뷰(직무) ＞ 2차 인터뷰(컬쳐 핏) ＞ 서류, 레퍼런스 체크 ＞ 최종합격', '', '전형이 생략되거나 추가 및 변경되는 등 지원 포지션 및 경력 등 기타 상황에 따라 유연하게 진행하고 있어요.', '개발자 및 일부 포지션의 경우 서류전형 다음으로 사전 테스트(코딩테스트, SQL 테스트, 과제테스트, 사전질문 등)를 진행해요.', '합격 여부와 관계없이 모든 전형의 결과를 안내해 드리고 있으며, 결과는 알림톡 및 메일을 통해 안내 드려요.', '레퍼런스 체크를 진행하게 될 시, 사전에 지원자님께 반드시 동의를 구하고 진행해요.', '입사일, 처우 협의 등은 최종합격 시 진행하고 있으며, 가능한 지원자님의 상황을 배려해 드리고 있어 요.', '', '', '', '【 이렇게 일하게 되실 거예요! 】', '', '⎸ 근무 형태: 경력 3년 미만 (6개월), 경력 3년 이상 (3개월) 수습', '', '- 수습 기간은 지원자님과 회사가 서로를 알아가는 소중한 기간이에요. 수습 기간에도 급여 100% 지급 및 동일한 복지가 적용돼요. 수습기간 이후 내부 기준에 따라 정규직으로 계약하고 있어요.', '', '⎸ 근무 지역: 해당 포지션은 서울, 부산 모두 채용 중이에요.', '', '- 서울 삼성역 인근 (강남구 영동대로 85길 34, 6층)', '- 부산 서면역 인근 (부산진구 서면로 39, 6층)', '', '', '', '【 이런 서류를 제출해 주세요! 】', '', '이력서', '사전질문', '', '아래의 사전질문에 대한 답변을 이력서와 함께 제출해 주세요!', '⎸페이타랩에 지원하는 이유는 무엇인가요?', '⎸페이타랩에 입사 시 어떤 방식 및 계획으로 업무를 진행하고 싶으신가요?', '', '', '경력기술서 또는 포트폴리오 (선택)', '⎸재무회계 업무 경험에 대한 자세한 설명이나 구체적인 자료가 포함되면 좋아요!', '⎸주도적으로 재무회계 업무를 진행한 경험 또는 세무 이슈를 파악하여 선제적으로 대응한 경험이 있다면 알려주세요.', '', '', '', '【채용에 진심인 채용담당자의 한마디】', '', '구성원분들을 부품으로 여기지 않고, 한 분 한 분을 소중하게 생각하는 만큼 시간이 오래 걸리더라도 신중하게, 우리와 맞는 분을 모시기 위해 노력하고 있어요. 일부 지원자분들에게는 페이타랩 합류 과정이 다소 까다롭고 긴 여정이라고 느끼실 수도 있지만, 서로에 대해 깊게 알아가는 시간이라고 생각해 주시고 우리의 채용 여정을 진심으로 바라봐 주시면 감사하겠습니다. :)']",100만원
231916,재무 회계,하이컨시,"['재무 관리 프로세스 고도화 (재무, 세무, 회계, 자금 등 전반적 관리 수행)', '재무 회계 관련 내/외부 이슈 검토', '내부 회계 관리 제도 관리', '자금 집행 및 운용 관리']","['유관 경력 2 ~ 10년', '대기업 및 중견기업 유관 부서 경력자']","['KICPA/AICPA/CTA 보유자 우대', '주도적인 업무 계획 및 문제 해결 능력 우수자', '보고 및 문서 작성 능력 우수자']","['각종 경조사 지원', '건강 검진 지원', '장기 근속 포상 제공', '생일 상품권 지급 + 생일 반차 제공', '육아 교육비 + 자녀 학자금 지원']",100만원
247084,재무회계 Lead,오토스테이,"['[ 함께 만들어 갈 업무입니다 ]', '· 월/분기/연간 결산과 재무제표를 작성합니다.(분기별 IFRS 변환)', '· Budget(사업계획)과 P&L(손익) 예측, 관리/보고를 통한 전략적 의사결정을 지원합니다.', '· 회계/세무 관련 이슈를 예상하고 해결 방안을 도출합니다.', '· 매출정산, 지급비용을 집행하고 관리합니다.', '· 부가세, 원천세 등 세무사항들을 검토하고 신고합니다.', '· 외부 회계 감사에 대응하고 내부 통제를 수행합니다.', '· 감사시 대응하고 관련업무를 지원합니다.', '· 고정자산의 감가상각 반영 업무를 진행합니다.', '· 자금 지출에 대한 파일을 작성합니다.', '· IR 및 투자사에 대응하는 업무를 합니다.']","['[ 이런 동료를 기다립니다 ]', '· 더존 아이큐브 사용이 가능하신 분을 찾습니다.', '· 능동적으로 업무를 수행하며 문제 해결 능력이 뛰어난 분을 모십니다.', '· 꼼꼼하고 정확한 업무 처리능력을 갖춘 분이라면 환영합니다.', '· 분석/전략적 사고와 긍정적인 태도로 원활한 커뮤니케이션이 가능하신 분을 기다립니다.']","['[ 이런 경험이 있으시다면 더 좋습니다 ]', '· 엑셀 / MS Office 프로그램을 통한 문서 커뮤니케이션 역량이 우수하다면 더욱 좋습니다.', '· 제조, 유통, 수출입 업종을 경험하신 분이라면 너무 좋습니다.', '· 스타트업 환경에서 재무, 회계 시스템을 구축해 본 경험이 있으시다면 꼭 지원해주세요.']","['# 업무', '+ 출퇴근 시간을 조율할 수 있습니다.', '· 출근 Time 8H~10H / 퇴근 Time 17H~19H / Core Time 10H~17H', '· 월 정해진 총 근로시간 내에 근무합니다.', '· 근무시간 자율적 활용을 통해 개인 시간 활용을 원활하게 합니다.', '', '# 생활', '+ 간식 지원합니다.', '+ 세차 무료 이용(직영점) 가능합니다.', '', '# 성장', '+ 직무 관련 교육을 지원합니다.', '· 세미나/컨퍼런스 등 참가시 비용 지원합니다.', '· 직무 관련 사외 교육시(온/오프라인 모두) 비용 지원합니다.', '', '# 휴식과 재충전', '+ 생일을 축하합니다.', '· 축하금을 드리고, 생일 당일 일찍 퇴근합니다.', '+ 명절비를 지원합니다.', '· 설, 추석에는 명절비를 드리며, 명절 전날 일찍 퇴근합니다.']",100만원
231384,재무관리 담당자,넷마블,"['□ 사업계획 수립 및 예상 손익 보고', '- 사업계획 수립 및 보고', '- 실적 및 예상 손익 보고', '- 본사 및 자회사 손익관리', '□ 프로젝트별 손익관리 및 재무분석 보고', '- 게임별 관리손익 결산/수익성 분석', '- 재무분석 자료 작성 및 보고', '- 경영진 의사결정 지원']","['- 경영관리 및 재무기획 업무 경력 10년 이상', '- 손익 분석/관리 및 사업계획 수립/손익 추정 경험을 보유하신 분', '- 해외법인 관리 경험을 보유하신 분', '- 문서 커뮤니케이션 역량(보고서 기획/작성)이 우수하신 분', '- 분석/전략적 사고, 원활한 커뮤니케이션이 가능하신 분', '- 영어 커뮤니케이션이 원활하신 분(fluent)']","['- 상경계열 학위 소지자', '- KICPA, AICPA, CFA, CMA 등 재무 자격증 보유자']","['[문화/여가활동]', '카페테리아식 복리후생(복지 포인트 제공)', '임직원 복지몰 운영', '사내 도서관 운영', '콘도 및 숙박시설 이용 지원', '', '[생활안정편의]', '명절 효도비 지급', '퇴근 교통비 지원', '경조사 특별 휴가 및 경조금 지급', '상조 물품 지원', '', '[근무환경]', '임직원 전용 카페 운영', '임직원 건강을 위한 사내 힐링센터, 피트니스센터 운영', '중식 및 석식 지원', '장기근속 휴가 및 포상금 지급', '', '[헬스케어지원]', '전 임직원 및 배우자 종합 검진 제공', '의료비 지원', '단체 상해보험 지원']",100만원
253180,[인턴] 재무 인턴 (Process Innovation),넥스트챕터(NextChapter),"['주요 과제', '채널 데이터 활용 프로세스 고도화', 'WMS 데이터 활용 프로세스 고도화', '구매관리 프로세스 고도화', '기타 업무 자동화', '세부 활동', '업무 수행자 인터뷰를 통한 기존 프로세스 맵 작성', '프로세스 맵을 토대로 개선안 협의', '신규 프로세스 정의서 작성', '신규 프로세스 도입 및 관리']","['최소 6개월 이상 근무가 가능한 분', '능동적인 업무 수행 및 다양한 직군의 사람들과의 원활한 의사소통 능력', '목표를 중심으로 프로세스를 설계할 수 있는 논리력, 유연한 사고력', '빠르게 변화하는 환경에 대한 적응력']","['MS Office 활용 능력', '기초 프로그래밍 경험(Python, RPA, SQL 등)', '데이터 활용 경험']","['넥스트챕터는 화려한 복지 제도 보다는 최고의 동료들과 함께 빠르게 성장할 수 있는 기회를 지속적으로 만드는 것이 더욱 중요하다고 생각합니다. 우리는 다른 회사에서 “복지 제도”라고 부르는 정책을 Nexter 경험 지원 정책(NXSP, Nexter eXperience Support Policies)이라고 부릅니다.', 'NXSP는 명확한 목적과 방향성 하에 활용될 경우 Nexter들의 긍정적인 행동의 변화를 이끌어내는 Nudge로서 기능할 수 있다고 믿습니다. NXSP는 생산성(Productivity), 건강(Health) 이라는 두 가지 목적 하에 설계를 하였으며, 앞으로도 지속적으로 넥스트챕터만의 정책을 만들어 나가고자 합니다.', '', '성과에 따른 스톡옵션 제공', '운동비 월 10만원 지원', '20만원 상당 건강검진 지원', '입사 시 각종 생산성 장비 구매 지원 10만원', '팀 회식비 인당 월 3만원 지원', '사내 식당 점심비 지원', '도서 구매 무제한 지원', '회사 근처로 이사 시, 이사비 100만원 지원', '야근 시 식대 15,000원 지원', '야근 후 귀가 시 택시비 지원']",
257555,[인턴] M&A Manager,딥서치,"['M&A 고객사 초기 대응 및 자료 정리 (TM / IM)', 'M&A 프로세스에 필요한 전략 및 수행에 대한 지원', '신규 고객사 발굴', '워크플로우 개선', '', '근무기간(최소 3개월~), 근무형태', '근무 기간은 최소 3개월부터 가능합니다. (채용전환형)', '', '인턴공고의 경우, 정규직으로 채용 시 합격보상금 50만원이 지급됩니다.']","['대학(원) 기졸업 및 졸업예정자', 'M&A, 금융, 경영 관련 전공자', '재무, 회계 관련 지식 보유', '문서 작성능력']","['M&A 관련 경험', 'M&A 시장에 대한 관심', 'CPA / CFA 공부 경험']","['도서, 워크샵, 세미나 등 업무 교육비 100% 지원', '유연근무 ( 9~10시 출근, 18~19시 퇴근 )', '식대 지원 ( 점심, 저녁 )', '간식 지원']",
257194,재무담당자 (본사 및 자회사),피피비스튜디오스(PPB Studios Co.),"['비용 전표 입력 및 관리', '재고수불부 작성', '세무 신고 및 대응 (부가가치세)', '법인카드 관리', '자금 관리', '해외 자회사 결산 및 관리원']","['재무/회계 경력을 3년 이상 보유하신 분', '영어 혹은 중국어로 업무가 가능하신 분']","['이커머스, 플랫폼, 성장하는 스타트업 업무 경험이 있으신 분', '외감법인 근무 경험이 있으신 분', '회계/세무 관련 자격증을 소지하신 분', '더존 ERP(IU) 경험이 있으신 분', '해외 자회사 관리 경험이 있으신 분', '', '연봉 대졸기준 4,000만원 이상 (면접 후 협의)']","['업무에만 몰입할 수 있도록!', '고급 전산 장비 및 듀얼 모니터 지원', '외근 및 야근시 외근 시 비즈니스 택시 지원', '자율 복장', '', '쉴 때는 제대로!', '점심 식사 지원', '고급 원두커피, 캡슐커피, 스낵 등 간식 제공', ""직원 휴게 공간 '마당' 운영"", '자유로운 연차 사용 (2시간 단위 반반차 지원)', '제주도 워케이션', '장기근속자 리프레시 휴가 (유급 휴가 5일, 휴가비 100만원)', '', '삶의 중요한 순간을 함께!', '입사를 축하해요! 웰컴키트 제공', '생일 조기 퇴근 및 선물 제공', '명절 선물 제공']",100만원
189877,[주니어] 재무회계 담당자(서울),페이타랩(패스오더),"['"" 충원이 아닌, 사세 확장에 따른 신규 포지션 채용이에요! “', '', '【 페이타랩 재무회계팀 】', '', '재무회계팀은 회사의 자금이 효율적으로 운영될 수 있도록 관리하고 건강한 재무 상태를 유지하여 회사가 안정적으로 목표에 도달할 수 있도록 지원하는 팀이에요. 회계 및 세무적인 이슈에 대한 리스크 관리를 통해 재무 정보의 신뢰성과 투명성을 유지할 수 있도록 노력해요.', '', '재무회계 담당자는 다양한 내부 구성원들과의 긴밀한 소통과 협업을 통해 최선의 의사결정을 할 수 있도록 유용한 정보를 제공하는 역할을 맡고 있기 때문에 폭넓은 전문 지식과 경험을 가진 사람들이 모여있어요.', '', '', '【 오시면 이런 업무를 하게 되실 거예요! 】', '', '매출 세금계산서 발행, 매출마감 및 결산, 가맹점 정산업무를 진행해요.', '주요자금 입/출금 거래내역 확인 및 회계 처리를 진행해요.', '전사 법인카드 운영 및 관리를 진행해요.', '재무제표 및 회계 관련 보고서를 작성해요.', '자금 흐름을 관리하고 회계 기준에 따른 비즈니스별 계정을 운영해요.', '', '', '', '【 이런 경험이 있다면 꼭 알려주세요! 】', '', '재무회계 업무 경험에 대한 자세한 설명이나 구체적인 자료가 포함된 포트폴리오 또는 경력기술서를 제출해 주세요.', '주도적으로 재무회계 업무를 진행한 경험 또는 세무 이슈를 파악하여 선제적으로 대응한 경험이 있다면 알려주세요.', '재무회계 담당자로서 어떤 생각과 가치관을 갖고 계시는지 궁금해요.']","['【 이런 분을 찾고 있어요! 】', '', '스타트업 또는 IT 기업에서 재무/자금/회계 실무를 1년 이상 수행하신 분', '기본적인 회계 및 세무 지식을 갖추고 계신 분', '회계처리 검토 및 이를 위한 시스템 운영 (ERP 등)이 가능하신 분']","['【 이런 분이면 더 좋아요! 】', '', 'IT 또는 비대면 결제 시장 및 O2O 서비스의 이해도가 높은 분', '스타트업, 플랫폼 업종의 정산 및 회계 업무에 대한 이해도가 있으신 분', '다양한 유관 부서와 유연하게 커뮤니케이션이 가능한 분']","['【 저희는 이렇게 일해요! 】', '', ""1. 그냥 하는 일은 없어요. 스스로 업무를 할 때 '왜?'를 항상 생각해요."", '2. 완벽한 결과물은 없다고 생각해요. 빠르게 실행해 보고 아니면 개선해 나가요.', '3. 하나의 팀으로 연결되어 있어요. 사내의 모든 정보는 투명하게 공유하고 있어요.', '4. 스포츠팀처럼 일해요. 각자의 포지션에서 최고가 되기 위해 끊임없이 성장해요.', '5. 개인의 성장을 지지해요. 누구나 원하는 만큼 성장할 수 있도록 회사가 지원을 아끼지 않아요.', '6. 직책 및 연차와 상관없이 모든 구성원이 자유롭게 소통하고 대단하게 피드백을 주고받아요.', '7. 관계는 수평적이에요. 직급 대신 ‘님’이라는 호칭을 사용하고, 상호 존칭을 사용하며 서로를 존중해요.', '8. 업무는 수직적으로 해요. 책임을 지는 의사 결정권자와 실무자의 구분을 명확히 해요.', '9. 구성원들을 진심으로 아끼고 배려해요. 일은 힘들 수 있지만, 사람 때문에 힘든 일은 없어요.', '10. 저녁 회식이 없어요. 다음 날 최상의 컨디션으로 일할 수 있도록 회사가 방해하지 않아요.', '', '', '', '【 당신의 성장을 적극적으로 지원해요! 】', '', '오직 일과 성장에만 몰입하고 집중할 수 있도록', '', '업무 효율을 낼 수 있는 최고 스펙 장비 제공', '┕ 맥북프로, LG 그램 (2-3년 주기 업그레이드)', '27” 듀얼모니터 제공', '쾌적한 업무 환경 제공 (스타일러, 가습기, IQ Air 공기청정기)', '키보드, 마우스 등 필요한 주변기기 맞춤 제공', '개인별 법인카드 지급 (식대, 출장 등에 사용)', '사유를 묻지 않는 자유로운 연차 사용', '', '원하는 만큼 배우고, 성장할 수 있도록', '', '교육비 무제한 전액 지원', '세미나, 컨퍼런스 참여 비용 무제한 지원', '20개 이상 교육 또는 온라인 콘텐츠 구독', '도서 무제한 구입 지원', 'Chat GPT 4.0 지원', '업무에 필요한 다양한 툴 적극 지원', '', '함께하는 구성원이 행복할 수 있도록', '', '법인카드 식대 지원(식대 1만 1천원)', '패스오더 포인트 매월 지급 (50,000P)', '에스프레소 머신, Tea 무제한 제공', '간식(스낵바) 무제한 제공', '종합건강검진 지원', '명절 백화점 상품권 지급', '생일 축하 백화점 상품권 지급', '구성원 경조사 발생 시 근조화환 및 경조 휴가, 경조금 지원', '', '', '', '【 이런 여정을 거치게 되실 거예요! 】', '', '⎸서류전형 ＞ 사전 테스트(필요 시 생략) ＞ 1차 인터뷰(직무) ＞ 2차 인터뷰(컬쳐 핏) ＞', '⎸서류, 레퍼런스 체크 ＞ 최종합격', '', '전형이 생략되거나 추가 및 변경되는 등 지원 포지션 및 경력 등 기타 상황에 따라 유연하게 진행하고 있어요.', '개발자 및 일부 포지션의 경우 서류전형 다음으로 사전 테스트(코딩테스트, SQL 테스트, 과제테스트,사전질문 등)를 진행해요.', '합격 여부와 관계없이 모든 전형의 결과를 안내해 드리고 있으며, 결과는 알림톡 및 메일을 통해 안내드려요.', '레퍼런스 체크를 진행하게 될 시, 사전에 지원자님께 반드시 동의를 구하고 진행해요.', '입사일, 처우 협의 등은 최종합격 시 진행하고 있으며, 가능한 지원자님의 상황을 배려해 드리고 있어요.', '', '', '', '【 이렇게 일하게 되실 거예요! 】', '', '⎸ 근무 형태: 경력 3년 미만 (6개월), 경력 3년 이상 (3개월) 수습', '', '- 수습 기간은 지원자님과 회사가 서로를 알아가는 소중한 기간이에요. 수습 기간에도 급여 100% 지급 및 동일한 복지가 적용돼요. 수습기간 이후 내부 기준에 따라 정규직으로 계약하고 있어요.', '', '⎸ 근무 지역: 해당 포지션은 서울, 부산 모두 채용 중이에요.', '', '- 서울 삼성역 인근 (강남구 영동대로 85길 34, 6층)', '- 부산 서면역 인근 (부산진구 서면로 39, 6층)', '', '', '', '【 이런 서류를 제출해 주세요! 】', '', '이력서', '사전질문', '', '아래의 사전질문에 대한 답변을 이력서와 함께 제출해 주세요!', '⎸페이타랩에 지원하는 이유는 무엇인가요?', '⎸페이타랩에 입사 시 어떤 방식 및 계획으로 업무를 진행하고 싶으신가요?', '', '', '경력기술서 또는 포트폴리오 (선택)', '⎸재무회계 업무 경험에 대한 자세한 설명이나 구체적인 자료가 포함되면 좋아요!', '⎸주도적으로 재무회계 업무를 진행한 경험 또는 세무 이슈를 파악하여 선제적으로 대응한 경험이 있다면 알려주세요.', '', '', '', '【채용에 진심인 채용담당자의 한마디】', '', '구성원분들을 부품으로 여기지 않고, 한 분 한 분을 소중하게 생각하는 만큼 시간이 오래 걸리더라도 신중하게, 우리와 맞는 분을 모시기 위해 노력하고 있어요. 일부 지원자분들에게는 페이타랩 합류 과정이 다소 까다롭고 긴 여정이라고 느끼실 수도 있지만, 서로에 대해 깊게 알아가는 시간이라고 생각해 주시고 우리의 채용 여정을 진심으로 바라봐 주시면 감사하겠습니다.']",100만원
257101,재무회계,리조트피플,"['ㆍ회계 및 재무관리 업무', 'ㆍ기장 업무', 'ㆍ세무 신고 및 세금계산서 발행', 'ㆍ기타 회계 및 재무 업무 지원']",['ㆍ자체 기장 능력 보유'],"['ㆍ주3일 자율출근제 시행', 'ㆍ4대보험 및 중식 식대 제공', 'ㆍ자기개발을 위한 취미 비용 지원', 'ㆍ송도신도시 테크노파크역 도보 10분거리', 'ㆍ설과 추석엔 마음을 담은 명절선물 지원', 'ㆍ야근시 석식 식대, 귀가비 지원', 'ㆍ전지점 무료 이용 (헬스, PT, 필라테스, 골프, 수영 등)']",['서류검토 ＞ 1차 면접 ＞ 채용'],100만원
