직무ID,직무,회사,주요업무,자격요건,우대사항,혜택 및 복지,채용보상금
250809,경영지원 매니저[재무],윗유,"['[재무]', '비용 청구 및 지급 관리(세금계산서&인보이스 발행 등)', '고객사(광고주) 광고 계정 관리 업무(구글, 메타, 틱톡 등)', '내부 정산 관리(법인카드 관리, 비용 청구 등)', '부가세 신고', '', '자기소개서 필수 항목', '-왜 ""윗유""에 지원하나요? 지원 동기를 꼭 기재 부탁드립니다.']","['학력: 학사 이상', '경력: 2년 이상', '문서 작성 우수자', '급성장하는 스타트업에서 체계를 만들어 갈 열정적인 태도를 갖춘 자', '해외여행 결격 사유가 없는 자(남성의 경우 입사일까지 병역을 마쳤거나 면제된 자)']","['동종업계 경력 보유자', '영어 능통자(영문 계약서 작성/검토 및 관련 소통이 가능한 자)', '국내외 중견/대기업 협력사 시스템 사용 경험자(APS, PMS, Ariba 등)']","['더블/트리플 모니터, 맞춤 PC 등 업무 몰입을 위한 장비 제공', '자율복장 및 (이름+님) 수평적 호칭 문화', '생일자 기프티콘 지급', '연차, 반차, 시차 제도 운영 및 자유롭게 사용', '스낵바 및 커피 머신 제공', '휴식이 가능한 공유 공간 제공', '강남구청역 초역세권 (도보 3분 거리)']",100만원
242339,경영지원 (인사/총무/재무),케이에스티씨,"['1. 인사 업무', '입/퇴사 직원 관리 / 근태관리 / 원천세 신고 및 급여관리등', '', '2. 총무 업무', '사내 자산(비품 및 소모품 관리) / 각종 문서관리', '', '3. 재무 업무(보조)', '재무 관련 보조 업무']","['대졸이상', '엑셀 등을 활용한 문서작업이 우수하신분', '원만한 대인관계 및 커뮤니케이션 능력을 보유하신분']","['영어/중국어 가능한 분', '암호화폐 관련 직무 경험', '문서작성이 능숙한 분']","['1. 급여 제도', '- 퇴직금, 4대보험', '2. 교육/생활', '- 점심식사 제공, 식비 지원 , 음료제공 (차,커피,간식)', '3. 근무 환경', '- 개인 장비 지급(노트북등), 휴게실, 회의실, 공기청정기, 카페테리아', '4. 조직문화', '- 수평적 조직문화, 회식강요 안함, 야근강요 안함, 자유로운 연차 사용, 자유복장']",100만원
249631,Jr. 재무기획 담당자,의식주컴퍼니(런드리고),"['사업 실적, 재무 구조, Issue에 대한 분석 및 보고서 작성', '사업 및 전사 전망에 대한 Financial Projection 수립 보조', '투자자 리포트 준비 및 대응']","['유관 경력 2년 이상이신 분', '재무/회계 등 재무 관련 지식 토대로 경영분석/재무분석 경험 있으신 분', 'Finance Projection 수립 가능 수준의 지식과 경험 있으신 분', 'MS-office 활용이 능숙한 분 (Excel, PPT 등)']","['스타트업 등 빠르게 성장하는 조직에서 손익분석/FP&A를 수행해 보신 분', 'IR 담당으로서 투자자향 보고 수행 경험 있으신 분']","['8시~10시 사이에 자율적으로 출근', '주 4.5일 근무제 : 매주 금요일 오전 근무', '월 2권, 읽고 싶은 자기개발 도서 구매 지원', '세탁 복지로 런드리고 서비스를 직접 경험', '점심식사 제공', '피트니스 센터 회원권 지원', '금정역 - 런드리고글로벌캠퍼스간 셔틀버스 운영', '생일자 반차', '연 1회 건강검진 지원', '역량개발을 위한 교육비 지원', '사내추천제도 (최대300만원 지원)', '', '', '우리가 일하는 조직문화', '모든 동료의 호칭은 ""OO님""', '출근 복장은 자유롭게', '신규 입사자의 빠른 적응을 위한 버디제도', '정보의 투명성과 열린 소통을 위한 매월 타운홀 미팅', '편안한 휴게공간(편안한 소파, 안마의자 등)', '친환경을 추구하는 문화', '', '[제출 서류]', '자유 양식의 이력서 (경력 세부사항 포함)']",100만원
235068,재무회계 리드,넥스트플레이어,"['연결 재무제표 작성 및 관리', '본사/기타 법인 마감 및 결산업무 (월/분기/반기/연단위)', '손익 분석 및 실적 보고서 작성 및 관리', '사업전략에 따른 재무 전략 수립 및 실행', '실사 및 외부기관, 회계 감사 대응', '재무 관련 법규 준수 및 리스크 관리', '회계관리 및 내부 통제 프로세스 구축 및 고도화 작업']","['재무회계 관련 학사 학위 이상 소지자', '재무회계 분야에서 최소 7년 이상의 경력 보유자', '연결 재무제표 작성 및 관리 경험 필수', '회계 감사 유경험자', '재무 분석 및 보고서 작성 능력']","['조직관리 및 리더십 보유자', '회계 ERP 시스템 사용 경험 (더존)', '거래처 정산, 회계 실무 경력자', 'IPO/IFRS 경험자', '이커머스 산업 경험자']","['! 자유로운 근무 환경을 제공해요', '분단위 시차출퇴근제도 (출근시간: 9시 30분 ~ 10시)', '여유로운 점심시간 제공', '영어 닉네임 사용 (직급 X)', '자유로운 복장', '트렌디한 사무실 업무공간', '', '! 충분한 휴가를 제공해요', '특별휴가 제공 (이사휴가, 생일반차, 명절 조기퇴근 등)', '월 1회 패밀리데이 (2시간 조기퇴근)', '리프레쉬 휴가 (2년 이상 근속자 휴가 5일 제공)', '건강 검진 시 반차 휴가 제공', '창립기념일 휴무', '', '! 든든하게 지원해 드려요', '연봉 외 별도 식대포인트 제공', '스낵바 운영', '야근 시, 식대 및 교통비 제공', '', '! 넥스트플레이어 직원이라 가능해요', '자사 브랜드몰 임직원 50% 상시 할인']",100만원
254002,해외법인 주재원 재무관리,디오,"['해외 법인의 재무 전략 수립 및 실행', '예산 관리 및 비용 절감 방안 제시', '재무 보고서 작성 및 분석', '해외 법인의 재무 상태 모니터링 및 개선', '해외법인 재무 회계, 손익 관리', '그 외 인사,총무,물류, 관리 등 업무 전반']","['경력 : 5년 ~ 10년(과장급)', '학력 : 대졸(학사)이상', '전공 : 경영, 재무, 회계 관련 학사 학위 이상 소지자', '', '영어 능통자, 해외 출장 및 주재 가능자 (터키, 인도, 미주 中 1 )', '외국어(비즈니스 영어) 가능자', '해외 주재원 및 해외 출장 가능자', '공인 영어 시험 점수 제출 必 (OPIC or TOEIC Speaking Test)']","['해외 법인 업무 경력', '제조업, 상장사 근무자', '현지 시민권자 및 영주권자 우대', '성실하고 열정적인 역량 보유자']","['구내식당 : 점심 · 저녁 식사 제공', '사내 카페테리아 : 커피 & Tea 무한 제공', '결혼 · 출산 장려금 : 각 100만원 지급', '사내 동호회 활동 지원 : 축구, 야구, 볼링 동호회 운영', '생활 편의시설 : 여직원 휴게실 및 체력 단련시설 운영', '전용 주차장 제공 : 본사 주차장 만석 시 인근 주차장 비용 일부 지원', '업무 장비 제공 : 듀얼 모니터 및 필요 기기 맞춤 제공', '교육 및 도서 구입비 지원']",100만원
256752,[재무본부] 재무회계 팀원 (주임~대리급),리브스메드,"['월 결산 (매출/비용마감 등) 및 분기/반기/연차 재무제표 작성', '외부감사 대응 업무 (담당계정)', '세무신고: 부가세 등']","['유관 경력 3~7년 경력자 (주임~대리급)', '회계/세무 관련 전공자 또는 이에 준하는 전문성을 보유한 자', '원활한 대인관계 및 커뮤니케이션 역량을 갖춘 분']","['IPO 경험 보유자', '외부 정기 감사 및 세무 조사 경험 보유자', '제조업 경력자', '더존 i-Cube 사용 경험 보유자']","['자유로운 연차사용', '최고 사양의 PC와 모니터 제공', '야근 식대 및 택시비 지원', '카페 수준의 최고급 커피머신 구비', '다양한 입맛을 만족시켜줄 음료 무제한 제공', '간식, 간편식이 항상 준비되어 있는 스낵바', '쾌적한 근무환경을 위해 공기청정기와 더불어 공기살균기 구비', '종합건강검진 패키지 지원', '동호회 지원', '', '복지제도는 리브스메드의 성장과 함께 지속적으로 업그레이드될 예정입니다.']",100만원
243829,Product Manager,팀에버플,"['팀에버플에서 진행되는 프로젝트의 제품 경험 전반', '클라이언트가 겪는 문제를 발견하고 주도적으로 해결책을 제시', '비즈니스 목표 달성에 집중한 UX,정의,정책 설계로 팀의 성장에 직접적으로 기여', '클라이언트의 성공을 우선 하지만, 사용자와 내부 협업 대상자도 함께 고려한 해결책을 제시', '기획부터 출시까지 최적의 설계를 반영할 수 있도록 프로젝트 전반에 걸쳐 디자인/엔지니어와 긴밀하게 협업', 'UX 설계 및 서비스,백오피스 정책,프로세스,화면설계, 인터렉션 정의', '커머스,금융,서비스등 PC / Mobile / App 제품 설계 전반의 업무', '프로젝트의 목적성에 따른 주요 문제를 해결하고 다양한 이해관계자를 조율, 매니징', '사용자조사 및 정성적/정량적 데이터를 근거로 전략수립과 고객경험을 개선', '생각을 빠르게 설계하고, 다양한 테스트를 통해 서비스를 고도화', '끊임없는 Iteration을 통한 프로덕트 고도화', '고객 문제 정의 및 해결을 통한 프로덕트-비즈니스 성장 드라이브', '', 'Business Tool', '- Product : MS Office, Figma, Google Workspace, Adobe', '- Collaboration Tools: Notion, Slack, Jira, Framer, 기타 분석 관련 Tool', '', '전통적인 서비스기획,웹/앱/백오피스 기획자의 업무 경험 및 PM/PO 경험을 가진분 모두 환영합니다.']","['서비스 기획 및 운영, 설계 경력이 1년 이상 ~ 15년 미만', '요구사항 분석, IA, User Flow, SB 작성, 서비스 정책 수립 가능하신 분', '웹/앱/백오피스 UI/UX 설계 경험이 있으신 분', '서비스 지표 및 분석, 업계 동향 리서치 가능하신 분', '긍적적 사고와 추진력으로 협업을 주도적으로 이끌어 갈 수 있는 분', '비즈니스와 기술의 중간에서 기대와 목적을 조율하며 프로젝트를 할 수 있는 분', '가설을 수립하고, 검증하며 프로덕트 고도화', '강한 책임감과 긍정적 태도를 기반한 문제해결 경험이 체화되어 있으신 분.', '다른 직군에게 자신의 논리와, 사용경험 설계를 설명하고 설득할 수 있는 커뮤니케이션 능력', '이커머스, 금융, 플랫폼, 백오피스 AI 중 한가지 이상의 기획 경력을 지닌 분', '특정화면 설계 기반이 아닌 프러덕트 전반적인 경험을 고려하여 설계하는 경험을 가지신분', '논리적사고, 정량적 분석, 사용자에대한 공감능력, 복잡한 비즈니스,정책해석에 따른 기획 전개능력', '자격 요건에 다소 부족해도, 업무에 대한 열정,오너쉽, 태도가 월등히 좋으며 배움의 의지가 강하신분', '무엇보다 가장 중요한 팀을 배려하고 협업할 수 있는 공감능력']","['이커머스 또는 금융,카드사,서비스 관련 제품 개선 경험이 있는 분', '특정 화면설계 기반이 아닌 프러덕트 내 전반적인 경험을 고려하여 설계 하는 경험을 하신분', '관련 포트폴리오( 정책서, 기획서 등 ) 제출자 우대', '고객이 겪는 문제에 공감(Empathy)하고 사용자 중심으로 문제를 해결 할 수 있는 분', '이해관계자, 개발자와 소통하며 요구사항 스펙에 맞춰 효율적으로 경험 설계할 수 있는 분', '복잡한 정보, 기술, 정책들을 이해하고 구조화된 UX를 설계, 완성한 경험이 있는 분', 'can-do attitude를 가지신 분']","['진정성있게 프로젝트를 바라보고 함께 도와주고 성장하는 무한신뢰할 수 있는 리더, 동료들이 함께합니다.', '프로젝트 성과에 따른 인센티브를 지원합니다.', '명절 상여를 지원합니다.', '정기휴가외에 리프레시 휴가를 별도로 제공합니다.', '야근에 대한 별도 휴가적립 제도를 제공합니다.', '좋은 장비 지원 (Imac 혹은 맥북프로, 윈도우 데스크탑/노트북)', '업무의 몰입을 돕는 라운지, 인테리어, 휴게시설', '푸드 / 여행 / 쇼핑 / 여가 / 의료 / 자기계발 관련 제휴사 할인 혜택이 제공 돕니다.', '정기적으로 무비데이 행사가 있습니다. ( 행사 이후 조기퇴근 )', '홍대입구 0분 거리에 위치하고 있습니다.', '직무능력 향상 교육 지원', '바쁘지 않은 시기에는 조기 퇴근할 수 있는 지원 체제가 있습니다.', '그외 새로 합류할 분들과 더 많은 혜택을 만들어가기 위한 준비를 갖추고 있습니다.']",100만원
238249,"경영지원, 연구지원 Junior (서울 1명)",시크한,"['총무, 재무보조', '행정지원(비품구매, 식사관리, 서류 취합 등)', '문서보관 및 관리', '회사자산 및 비품관리', '전표처리', '근무지 : 서울시 관악구 호암로24길 6 히어로-5 501호']","['학력 : 초대졸이상', '경력 : 경력 1년이상', '무역, 영업 등 유관 경력이 있으신분', '빠른 실행력과 적응력, 도전적 업무 태도를 지니신분', '유관 부서와의 커뮤니케이션을 통해 업무를 진행한 경험을 가지신분']","['데이터 기반 정기 보고서 작성 경험 있으신분', 'M/S Office 활용능력 뛰어난분', '영어 커뮤니케이션 가능하신분']","['수평적인 소통과 존중을 담은 닉네임 문화', '자유로운 연차 사용 가능', '부담없는 출장 여정을 위한 출장 여행비 지원', '가족과 행복한 시간을 보낼 수 있도록 명절 선물 및 경조사 지원', '늦게까지 고생한 분에게 야근 식대 지원']",100만원
252566,[제이엘케이] 재무회계 경력자_근무지 일본,원티드 재팬(wanted),"['1. 월간 및 분기 결산 업무', '2. 연도 및 분기 서류 작성', '3. 금융 기관 대응', '4. 고정 자산 리스 대응', '5. 내부 통제 정비 및 운영 체계 구축', '※ 변경 범위: 적성에 따라 회사에서 정한 업무로 변경될 가능성이 있습니다.', '', '・희망에 따라 이사회 / 경영 회의 운영 / 전사 예산 수립 / 조달 업무 / IR 업무 등 경영 기획과 관련된 업무에 참여할 수 있습니다.', '・사업부 직원들로부터 신뢰를 받고 있으며, 긴밀하게 협력해야 하므로, 양방향 커뮤니케이션을 통해 업무를 진행할 수 있는 포지션입니다.']","['・재무 회계 업무 3년 이상 (회계 감사 경력자)', '・원어민 수준의 일본어', '일본 취업비자 소지자 및 일본 거주자']","['・원가 계산 / 금융 기관 대응 / 고정 자산 리스 대응 등의 경험', '・AI에 대한 지식 및 관심', '・항상 성장하기 위해 개선하는 분']","['・근무지는 도코도 츄오구 니혼바시', '・JLK는 의료 인공지능 1호 상장 기업으로, 일본법인에서 같이 성장하실 분을 찾습니다.', '', '＜채용보상금 안내＞', '해당 포지션은 한국 계좌가 있는 경우 50만원 지급됩니다.', '', '＜기타 안내＞', '채용 전형 진행을 위해 원티드에서 안내메일 및 커피챗이 진행될 수 있습니다.']",
250492,관리부문(회계 / 재무) 사원 (3~5년),홈즈컴퍼니,"['매출/매입 마감, 증빙대사 및 ERP 입력', '재무상태표 계정별 잔액명세서 정리', '월/분기/년간 결산', '경영/재무 성과 분석', '외부감사 수감', '부가세 신고', '관리 업무(인허가,영업신고,보험관리,공과금처리,업무PC관리 등)', '인사 업무(4대보험,원천세 등)']","['회계 또는 재무 관련 학사 학위 이상', '3~5년 이상의 관련 경력', '재무 보고서 작성 및 분석 능력', 'ERP 시스템 사용 경험', '우수한 커뮤니케이션 및 문제 해결 능력']","['CPA, CFA 등 관련 자격증 소지자', '부동산 업계 경험자', '영어 능통자', '팀워크 및 협업 능력 우수자', '데이터 분석 및 활용 능력']","['유연 근무제도', '직원 건강 검진 및 복지 포인트 제공', '자기 계발 지원 프로그램', '성과에 따른 인센티브 지급', '편안한 근무 환경 및 최신 장비 제공']",100만원
239293,[글로벌 K-FOOD 플랫폼] 재무/회계 담당자,유나이티드보더스,"['What we do', 'ㆍ 자금집행', '- 자금 집행 및 기장 반영', '- 매입 / 매출 관리', '- 재고, 선급금, 미지급금 관리', '- 본사-지사 간의 거래 회계 처리', 'ㆍ 회계 결산 지원', '- 월 / 분기 / 연단위 회계 결산 및 본지사 연결재무제표 지원', '- 부가세 신고 지원', 'ㆍ 경영 지원', '- 기타 경영지원 및 재무 업무 진행', '- 경영지원 프로세스 구축 및 효율화', '', 'What we Challenge', 'ㆍ 미국 시장을 목표하는 K-FOOD 플랫폼의 재무/회계 프로세스를 수립합니다', 'ㆍ 한품 내부 다른 팀과의 원활한 협업을 통해 한품을 더욱 성숙한 팀으로 리드합니다.']","['회계/재무/자금 3년 이상의 경력 혹은 그에 준하는 업무 역량을 보유하신 분', '회계 프로그램 사용 경험, 엑셀 사용이 능숙하신 분', '숫자에 대한 이해도가 높고 업무처리가 꼼꼼하신 분']","['재무/회계 관련 자격증을 보유하신 분', '자사몰, 오픈마켓 등 온라인 매출정산 경험이 있으신 분', '스타트업에서 더존 ERP 도입 및 사용 경험이 있으신 분', '세무/회계, 수출입 법인 근무 경험', '본지사 연결 재무제표 작성 경험']","['[한품 혜택]', '', '자유롭고 열정적인 분위기에서 본인과 팀의 성장에 도움이 되는 것은 모두 하실 수 있어요.', 'Talent 획득을 위한 예산을 별도로 배분해 지원해 드리고 있습니다.', '한국 명절에는 회사에서 선물을 드리고 있어요.', '지각걱정 NO! 유연하게 출퇴근하고 있어요.', '몰입을 지원하기 위해 오피스도 업그레이드 되고 있습니다.', '업무 성장을 위한 모든 교육을 지원해드리고 있어요.', '귀중한 생일은 일찍 퇴근하는 Birthday Pass!', '한품에서 판매하는 상품은 특가에 언제든지 사실 수 있어요.', '', '언제든지 궁금한 점 편하게 문의주세요', '(팀원들의 사랑을 듬뿍x100 받는 보더콜리가 기다리고 있어요)']",100만원
235257,프로덕트 그로스 마케터,오니스트,"['[단 1개 제품으로 1,000억 매출을 만들어나갈 프로덕트 그로스 마케터]', '오니스트는 매년 꾸준히 성장해 올해 연 매출 100억을 향해 달려가고 있지만 증명된 제품력과 브랜드 팬층을 기반으로 더 큰 성장을 만들어내고자 합니다.', '프로덕트 그로스 마케터는 1개의 제품을 책임지고 그로스를 만들어냅니다. 권한이 큰 만큼 고객에게 닿는 전 과정을 주도적으로 전략적으로 설계하고 그로스를 만들어내길 기대합니다.', '높은 기준과 탁월함, 그리고 스마트한 문제 해결을 통해 폭발적인 그로스를 함께 만들어내고, 단 1개 제품으로 1,000억 매출을 만들어내는 유례없는 성과를 만들어갈 분을 찾고 있습니다.', '', '[얻어가실 수 있는 것]', '국내에서 가장 빠르게 성장하는 이너뷰티 브랜드에서 성장 경험을 만들 수 있어요.', '주도적으로 의견을 내면, 무엇이든 시도해볼 수 있는 주도적인 환경에서 일할 수 있어요.', '자율과 책임이 공존하는 문화에서 논리적인 사고와 넓은 시각을 가질 수 있어요.', '', '프로덕트 그로스 마케터는 하나의 제품이 고객에게 닿는 전 과정을 책임집니다.', '', '[업무 예시]', '자사몰, 네이버 매출 분석 및 판매 전략 수립, 실행', '구매 주기에 따른 광고 운영, 프로모션, CRM 전략 수립 및 실행', '제품 별 P&L 관리 (매출, 영업이익)', '제품 별 온/오프라인 영업 전략 수립', '마케팅 풀 퍼널 매체 전략 수립 및 집행', '제품 별 커뮤니케이션 컨셉 및 스토리텔링 개발 (USP 기획, 상세페이지 등)']","['논리적 사고를 기반으로 한 전략 수립 능력', '콘텐츠와 데이터를 기반으로 한 매출 확장 경험', '매출 책임에 대한 높은 이해도', '원활한 커뮤니케이션을 통한 협업 능력', '재무에 대한 이해']",['소비재 마케팅 경력'],"['이너뷰티 실천지원금 매월 20만원 지급, 1시간 단위 연차 사용, 자유롭게 출근하는 유연근무제, 오니스트 제품 할인, 최신 장비 지원, 교육비 지원, 명절 선물 지급, 간식 지원']",100만원
204294,재무 회계 담당자(ERP 경험 1년이상),스쿨버스,"['ㆍ세무 및 회계 업무 담당자', 'ㆍERP 시스템을 활용한 재무 데이터 입력 및 관리', 'ㆍ월별, 분기별, 연간 재무 지표 작성', 'ㆍ관리 회계, 재무 분석 및 지표 관리', '', '구글플레이 링크', 'https://play.google.com/store/apps/details?id=com.schoolbus.ride', '', '앱스토어 링크', 'https://apps.apple.com/kr/app/%EB%9D%BC%EC%9D%B4%EB%93%9C-ride-%ED%86%B5%ED%95%99%EC%B0%A8%EB%9F%89-%EC%96%B4%EB%A6%B0%EC%9D%B4-%ED%86%B5%ED%95%99%EB%B2%84%EC%8A%A4-%EA%B4%80%EB%A6%AC/id1583899275']",['모집 인원 1명'],"['ㆍ이카운트 ERP, 더존 ERP 사용 경험 1년 이상', 'ㆍ자체 기장, 결산, 외감 및 외감 지원 경험 1년 이상', 'ㆍ재무 회계에 대한 경험이 가장 우선됨']","['휴가 자율, 야근 없음, 매월 금요일 얼리 퇴근제 시행(월 1회 리프레시 반차 제공)']",100만원
247978,재무/회계 담당자(5년 이상),윌로그,"['재무제표 작성 및 투자자 보고', '정확한 재무제표를 작성하고, 이를 통해 투자자 보고 자료를 작성 합니다.', '', '회계 정책 및 관련 프로세스 수립', '정확한 회계 정책을 수립하고 재무 관련 프로세스를 체계적으로 수립, 관리합니다.', '', '외부 감사, 재무실사 대응', '외부 감사 및 재무실사 요청에 신속하게 대응하고, 필요한 자료를 준비합니다.', '', '매출, 매입(채권, 채무) 관리', '고객과 공급업체와의 거래 내역을 정확하게 기록하고, 채권과 채무를 관리합니다.', '', '재고자산수불부 작성 및 원가/재고 관리', '재고자산수불부를 작성하고, 재고 및 원가를 효율적으로 관리합니다.', '', '자금 관리 및 예산편성 지원', '자금의 유입과 유출을 관리하고, 예산 편성을 지원합니다. 이를 통해 회사의 자금 흐름을 효율적으로 운영합니다.', '', '기타 재무 관련 이슈 파악 및 대응', '회사 내외부에서 발생하는 재무 관련 이슈를 신속히 파악하고 대응합니다.']","['5년 이상의 재무 또는 회계 실무 경력이 있는 분', '더존 ERP를 통한 자체기장 및 결산 경험이 있는 분', '재무/회계와 관련된 학위 또는 자격증 소지한 분', '외부감사/투자자 대응 경험을 보유한 분', 'IFRS 전환과 IPO 준비 및 진행 경험이 있는 분', '코스닥 또는 코스피 상장사 근무 경험이 있는 분', '스타트업에서 투자 유치를 경험해본 분 (시리즈 B, C)']","['IT, 물류 B2B 회사에서의 경험이 있는 분', '재무 ERP 구축 경험이 있는 분', '회사의 재무/회계 현황에서 인사이트를 찾아내고 고도화할 수 있는 분', '다양한 업무 중 우선순위를 정할 수 있고, 꼼꼼한 실행력을 가진 분', '스스로 역량 향상에 노력하고, 조직과 함께 성장하고자 하는 분', '원활한 커뮤니케이션 역량 및 주도적인 업무 수행 역량을 갖춘 분', '영어로 커뮤니케이션을 하실 수 있는 분', '', '[ 함께 일하고 싶은 동료의 모습입니다. ]', '무에서 유를 창조, 혹은 더 나은 서비스를 위해 이바지할 수 있는 본인만의 스킬이 있는 분', '실패를 두려워하지 않고, 담대하게 시도하여 새로운 가치를 만들 수 있는 분', '동료와의 협력, 협업을 통해 문제를 다뤄내는 데에 성취감을 느끼는 분', '공동의 목표를 이루기 위해 저마다의 자리에서 개성을 발휘하고 싶은 분']","['근무요일 : 월 ~ 금(주5일)', '- 유연근무제 [ 출근 08:30 ~ 10:30 / 코어 10:30 ~ 17:30 ]', '- 근무지 : 서울 강남구 삼성로 507, JS타워 9층 (2호선 삼성역/선릉역, 9호선 삼성중앙역 도보 8분이내)', '', '복지', '- 유연근무제 도입확정 (8시30분 ~ 10시30분 사이 출근)', '- 오피스 내에 집중 업무공간, 전화부스, 카페, 수면실, 샤워실 등', '- 입사와 동시에 11일 연차 미리 제공(반차, 반반차 등 자유로운 연차사용)', '- 생일 반차(유급휴가) 제공', '- 커피, 음료, 간식이 무제한인 사내 카페테리아', '- 프리미엄 건강검진 : 본인과 가족1인 포함 (입사 1년 후 매년/ 반차 제공)', '- 장기근속 리프레시 휴가 (3년, 5년, 7년)', '- 야근 식대, 택시비 지원']",100만원
