직무ID,직무,회사,주요업무,자격요건,우대사항,혜택 및 복지,채용보상금
255135,재무회계 담당자,패스트뷰,"['""우리와 함께 할 업무에요.""', '', '자금업무(자금 운용 계획 및 수립, 진행)', '매출 정산 데이터 검증 및 프로세스 개선', '사업부별 손익, 예산관리, 분석, 보고', '온라인 광고 정산', '매출원가 및 재고자산 관리', '법인카드 관리', '분기결산', '자회사 관리', '투자사 요청사항 대응']","['""이런 분과 함께 하고 싶어요.""', '', '경력 3년 이상', '스타트업 회계 업무 경험이 있으신 분', '자체기장 / 결산 업무 가능하신 분']","['""이런 경험이 있으시면 더 좋아요.""', '', '이커머스 정산 및 회계 업무에 대한 높은 이해도', '상장회사 회계 업무 유경험자', 'ERP 사용 경험']","['""패스트뷰는 매년 트렌디한 인사제도와 혜택을 업데이트하고 있습니다.""', '', '1. 우리는 파격적으로 보상해요.', '공정하고 투명한 평가로 매월 KPI 달성에 따른 팀원들에게 상당한 인센티브를 지급해요.', '매월 팀별 우수평가사원 MVP를 선정해 상여금을 지급해요.', '개인의 빠른 역량 성장을 반영하여 6개월마다 연봉 인상을 검토하고, 업계 최고의 연봉으로 보상해요.', '성과에 기여한 개인의 헌신과 노력을 보상하기 위해 특별 스톡옵션을 제공해요.', '리더급들은 평가를 통해 급여 외에 특별 인센티브 수당을 지급해요.', '믿고 같이가는 지인 추천 인센티브로 최대 500만원까지 지원해요.', '', '2. 우리는 균형있게 일해요.', '입사와 동시에 12개 연차를 제공해요', '각종 경조사비와 경조휴가를 든든하게 제공해요.', '이유불문 연차는 물론 반차, 반반차 등 자유롭게 사용이 가능해요.', '균형있는 삶을 위해 연차 외에 리프레시 휴가를 해마다 제공해요.', '1년 근무 : 유급휴가 1일', '2년 근무 : 유급휴가 2일', '3년 근무 : 유급휴가 3일 + 50만원', '4년 근무 : 유급휴가 4일', '5년 근무 : 유급휴가 5일 + 100만원', '', '3. 우리는 일할맛나게 즐겁게 일해요.', '강남역 주변 다양한 맛집에서 할인을 받아요.', '회사와 제휴되어 있는 각종 운동, 여행/레저/숙박, 자기개발/취미, 생활 서비스를 즐길 수 있어요.', '내 생일만큼은 일찍(반반차) 나가서 오후부터 만끽할 수 있어요.', '명절 연휴 전 날에는 무조건 점심 먹고 바로 집에 가요.(홈커밍 티켓 일찍 예매하세요!)', '명절 선물로 연간 백화점 상품권 40만원을 지급해요.', '출산 시에는 다양한 축하 선물이 준비돼있어요.', '전사 공모전(네이밍 공모전, 로고 공모전, 퀴즈대회 등)을 개최해서 투표로 500만원 이상의 상금을 지급해요.', '매월 소정의 상품을 타갈 수 있는 사내 미니 이벤트도 있고, 분기마다 쏟아지는 선물과 함께 메이저 이벤트도 준비돼있어요.', '', '4. 우리는 최고의 대우를 해드려요.', '에스프레소 머신, 고급 원두, 편의점급 무료 스넥룸을 무제한으로 제공해요.', '(당 충전을 위해 라면, 컵밥, 과자, 음료, 아이스크림 등)', '묻지도 따지지도 않는 팀별 활동비 지급으로 팀원간 소통을 지향해요.', '(맛집탐방, 단체 마사지, 단체 관람 등)', '업무 필요에 따라 법인 스마트폰 및 통신비를 지원해요.', '자기계발 및 업무 관련 도서와 온라인 교육비를 지원해요.', '직무 관련 컨퍼런스와 외부 강의, 세미나 등 참여를 지원해요.', '청년중소기업 소득세 감면제도를 시행해요.', '', '5. 우리는 일할맛나는 환경을 갖췄어요.', '강남역 4번 출구 도보 4초 거리의 패스트파이브 강남2호점에 두개층을 사용해요.', '카페같은 라운지, 소파 휴식 공간, 프라이빗한 폰부스, 다양한 회의실 등 사용 가능해요.', '직급을 간소화하고 “님”자 호칭 사용으로 수평적인 커뮤니케이션 문화를 운영해요.', '자유로운 근무 복장으로 편하게 일해요.']",100만원
255589,재무회계 리드,엔라이튼,"['[회계]', '본사 및 자회사 월별 손익 분석 및 결산 리딩', '별도/연결 재무제표 작성 및 외부 감사대응 리딩', '그 외 회계이슈사항 검토', 'IFRS전환 (예정)', '', '[세무]', '법인세, 부가가치세 등 신고 및 총괄', '매출 및 매입 마감 관리', '그 외 세무이슈사항 대응', '', '[자금]', '자금수지 관리', '자금계획수립 및 관리', '', '[기타]', '내부통제시스템구축 (예정)', '투자자 실적 보고 자료 작성 및 대응', '회사 주요 의사결정을 위한 재무 자료 작성 및 보고', '그 외 재무/회계/ 관련 업무 수행']","['경영학, 회계학 등 관련 분야 학사 이상 학위 보유하신 분', '재무 또는 회계 업무 경력 최소 10년 이상이신 분', '공인회계사 자격 보유자']","['연결재무제표 작성(주석 포함) 및 결산 경험 있으신 분', '공사, 상품, 제품원가 및 매출에 대한 이해도가 있으신 분', '팀 운영 및 기타 리더쉽 경험이 있으신 분', ""다양한 직군의 사람들과 원활한 의사소통이 가능하신 성향을 보유하신 분'"", 'IPO 경험 있으신 분']","['ㆍ성장할 수 있도록 지원합니다.', '- 수평적인 소통문화(닉네임 호칭, 정기적인 타운홀미팅 운영, 다면피드백 시행 등)', '- 에너지 및 각 분야 최고의 전문가로 구성된 동료', '- 2주간 운영되는 체계적인 신규 입사자 OT 프로그램', '- 자격증 취득 지원 (연간 200만 원 한도)', '- 업무 관련 세미나 및 도서 지원', '- 멘토링 활동 지원', '', 'ㆍ충분한 휴식으로 균형있는 삶을 응원합니다.', '- 별도 승인 없는 자유로운 휴가 사용', '- 리프레쉬 휴가 제도 (근속 3년 단위로 휴가 5일 부여)', '- 권장휴가(징검다리 휴일 기간 등)제도 운영', '', 'ㆍ건강하고 쾌적한 환경에서 일할 수 있도록 지원합니다.', '- 종합건강검진 지원 (30만 원 상당)', '- 야근 시 편안하고 안전한 귀가를 위한 카카오 법인 택시 운영', '', 'ㆍ슬픈 일, 기쁜 일을 함께 나눕니다.', '- 경조사비 및 경조 휴가 지원', '- 생일/졸업/이사 및 기타 경조 휴가 지원', '- 본인 및 배우자 출산 시 10만원 상당의 출산 선물 제공', '- 명절선물 지원(10만원 상당)', '', 'ㆍ그 외 직원추천 보상제도 운영 (50만원~300만원 직군 및 경력에 따라 차등 적용)', '', '※이 외에도 엔라이튼 인재들에게 필요한 복리후생을 지속적으로 기획하고 있으며, 복리후생은 상황에 따라 변경될 수 있습니다.', '', '고용형태', '정규직 (수습기간 3개월)', '수습은 전 임직원을 대상으로 기본 3개월 적용되며, 수습 관련한 세부 운영은 사내 내규 또는 제도에 따름 (최대 6개월까지 적용)', '※ 해당 공고는 엔라이튼 그룹 채용 공고로 직무에 따라 소속은 변경 될 수 있습니다.']",100만원
256352,재무회계팀 Lead,더스윙,"['IFRS 결산 전반 및 재무제표 작성', '외부감사 대응 및 관련 Issue 검토', '법인세, 부가세 등 세무 Issue 검토', '자회사 결산 검토 및 연결회계 지원', '투자자 대응, 주주총회 및 이사회 운영']","['학사 이상', '관련직무 경력 5~10년']","['상장사 결산업무 경험이 있으신 분', '엑셀 고급 사용자', '상경계열 전공자']","['SWING LIFE', '', '자기계발비(운동, 학습, 등) 지원 : 연 100만원 한도, 지출 금액의 80% 지원', '어학교육비 지원 : 연 160만원 한도, 지출 금액의 80% 지원', '신용대출 지원 : 기업은행 계좌 6개월 이상 급여이체시, 신용대출 연계 및 이자지원', '전세자금대출 지원 : 기업은행 연계대출 이자지원 또는 회사 자체 지원', '중식, 야근석식비 지원 : 중식 1만원, 야근 1.5만원 (법인카드로 결제)', '팀 회식비 지원 : 1인당 월 3만원 회식비 지원 (팀별활동비 3만원 추가 지원)', 'SWING 킥보드 이용권 지원 : 무제한 이용쿠폰 지급', '야근 택시비 지원 : 23시 이후 퇴근시 택시비 지원', '생일선물&반차 지원 : 부모님,소중한 분에게 꽃바구니와 와인을 증정& 조기 퇴근', '타사 모빌리티 이용금액 지원 : 경쟁사 공유 모빌리티 서비스 이용 시 연간 한도 내 지원', '근로시간 : 시차 출근제 (9시 ~ 10시 사이 자유롭게 출근)', '안식 휴가 지원 : 3년 근속 시 1개월 리프레시 유급 휴가', '종합건강검진 지원 : 국내 최고 건강검진업체 KMI와 제휴를 통한 종합건강검진 지원', '', '이 외에도 구성원들이 업무에 몰입할 수 있도록 다양한 제도를 준비중입니다.']",100만원
250847,재무회계팀 팀원,올리브인터내셔널,"['[담당하시게 될 업무를 소개합니다]', '', '월 결산 자료 작성 및 보조', '플랫폼 B2C 및 B2B, 수출 등 매출 정산 및 검토', '부가세신고']","['[이런 분과 함께 성장하고 싶습니다]', '', '학력 : 초대졸이상', '경력 : 3 ~ 5년', '부가세 자체 신고 가능']","['[이런 분이면 더욱 좋습니다]', '', 'ERP 사용 경험우대', '엑셀 등 MS 활용', '원가관리 경험자우대']","['- 점심 식대 / 야근 식대 별도 지원', '- 연간 문화비 지원(연간 100만원 한도)', '- 반반차 제도 운영', '- 자사제품 70~80% 할인', '- 명절 상여금 지급', '- 건강검진 지원', '- 3년 만근 시 휴가비용 지원(100만원 지급)', '- 생일자의 경우, 생일축하금+생일자 2시간 조기퇴근+생일선물 지원', '- 자유롭게 논의하는 분위기 속에서 비즈니스의 여러 가지 의사결정 사항에 참여', '- 지옥철을 피하여 월~목 10시~19시 근무 / 매주 금요일 시차 출퇴근제 실시']",100만원
256366,재무회계/경영지원 담당자 (5년~7년),테이텀,"['재무회계/경영지원 담당자는 이러한 업무를 담당해요!', '테이텀 시큐리티의 재무회계/경영지원 담당자는 회사가 고객을 위한 해결책을 만들고 실행하는데 필요한 모든 재무적 제반 사항을 서포트하는 역할을 합니다. 내외부의 다양한 팀과 협업하며, 회사가 효율/효과적인 방식으로 성장할 수 있도록 크고 작은 문제들을 해결하고 리스크에 대비합니다.', '', '회계 처리 및 결산 실무', '- 월별/분기별/연간 결산 마감 및 재무제표 작성 지원', '- 매입매출, 일반경비 정산 및 자금 관리', '- 회계 정책 수립 및 제도 개선 대응', '법인세 및 부가세 검토 / 기타 회계 이슈 모니터링', '재무 분석 및 투자/IR 등 비즈니스 지원', '- 연간 예산 수립 및 현황 관리', '- 주요 재무 지표 / 손익 예측(Forecast) 분석을 통한 재무 개선 관리', '- 주주총회, 투자자/감사 대응 및 IR 관련 자료 지원', '- 기타 재무 Projection 및 수익성 관리 업무 지원', '정부 지원 사업비 관리 및 운영 지원']","['Must-have', '재무, 회계에 대한 기본 지식과 관련 실무 경험을 보유한 분 (총 경력 최소 5년 이상)', '스스로 필요한 업무를 찾아서 주도적으로 해결할 수 있는 분', '사업계획서, IR 자료 작성을 위한 문서 작성 능력 및 관련 행정 처리 능력을 보유한 분', '긴장감 있는 업무 중에도 목표를 명확히 추구하고 최선의 결론을 도출해 내는 의사소통 능력이 있으신 분', '스타트업 투자 Scene과, 정부사업에 대한 이해를 바탕으로 적절하게 대응/대관 업무를 수행할 수 있는 분', '업무 체계화, 자동화 역량과 타 부서와의 커뮤니케이션 능력이 탁월한 분']","['Nice to have', '스타트업 재무/회계 업무를 총괄 리드한 경험이 있는 분', '스타트업 비즈니스에 대한 이해도와 관심이 높은 분', '다양한 비즈니스 상황에서 회계/세무 관점에서 문제해결 경험이 많으신 분', '정부과제에 대한 이해와 실무 경험이 있는 분']","['테이텀의 성장을 위해 아낌없이 지원합니다!', '직무 관련 도서 구매 및 교육수강비 지원', '자격증 취득을 위한 시험응시료 100% 지원 (합격자에 한함)', '외부 클라우드 파트너사 세미나, 컨퍼런스 등 적극적인 학습 독려', '외부 멘토/전문가 연계를 통한 직무 협업 지원', '서로의 성장을 자극하는 2주 단위 개발 스프린트 회고 문화', '', '업무 생산성을 높이기 위한 최적의 환경을 제공합니다!', '오전 8시~11시 사이 자율 선택하는 시차 출퇴근 제도 운영 (1일 소정근로시간 8시간 준수)', '근속 6개월 이상 재직자 대상 최대 연 2회 워케이션 기간 제공', '안전 귀가를 위해 밤 11시 이후 퇴근 시 야근택시비 지원', '업무에 더욱 집중할 수 있도록 다양한 스낵과 음료 제공', '', '잘 쉴 수 있도록 지원합니다!', '3년, 5년, 10년 장기 근속자를 위한 리프레시 휴가 지원 (휴가비와 함께!)', '생일 주간 반차 제공', '명절 보너스, 각종 경조 휴가 및 경조금 지원', '본인 및 배우자 출산 선물 지급']",100만원
257474,재무회계팀 - 신입,브라이트에너지파트너스,"['1)결산업무', '회사 및 종속회사의 전표처리 및 결산', '개별 및 연결재무제표 작성, 결산명세서 작성', '기말 개별 및 연결감사보고서 작성 및 공시', '2)세무업무', '법인세, 원천세 등 각종 세금신고', '세금계산서 발행/ 부가가치세 자료 작성 및 신고', '관할세무서 대응', '3)자금업무', '자금 증빙 검토 및 집행', '회사 및 종속회사 자금 입/출금관리 (자금수지)', '종속회사 대여금 관리', '4)기타', '주주 결산 보고 및 대응', '이사회 및 주주총회 개최', '회사 서류관리 및 기타 사무 지원업무']","['회계/세무학과 출신 또는 회계세무 관련 자격증을 보유하신 분', '꼼꼼하고 주도적이며 능동적으로 문제를 분석하고 해결안을 도출할 수 있는 분', '긍정적이며 밝은 Brite Vibe를 전파할 수 있으신 분']","['각종 MS Office 활용 능력이 우수하신 분', '회계관리 프로그램(더존 i-Cube 등) 경험을 보유하신 분', '사내 내부통제 업무 경험을 보유하신 분', 'DART(전자공시시스템) 공시 경험을 보유하신 분', '태양광/에너지/인프라 섹터에 대하여 이해도가 있으신 분', 'B2C Business 경험을 보유하신 분', '영어 커뮤니케이션이 가능하신 분']","['BEP가 말하는 기업 문화의 혁신이 궁금하신가요?', '똑똑하고 일 잘하고 동료를 사랑하는 크루를 모집하는 만큼 최고의 보상과 대우를 해드리고 있습니다.', '', '1) 클라스가 다른 근무 : 10:00 ~ 17:00 집중 근무, 재택근무 주 1회 신청 가능', '2) 클라스가 다른 휴가 : 무제한 휴가 사용 가능.', '3) 클라스가 다른 리프레쉬 : 12월 마지막 주, 1월 첫 주 리프레시 휴가 시행', '4) 클라스가 다른 장비 : 최신 노트북 및 모션데스크, 허먼밀러 의자 고급 모델 제공', '5) 무선통신비 및 구입비 지원', '6) 도서구입비 지원', '7) 매년 건강검진비용 부족하지 않게 지원 (가족 포함)', '8) 업무적인 교육비는 물론이고 체력 단련, 취미 활동 등 자기계발비까지 지원', '9) 각종 경조사비 지원 (가족의 생일까지 챙겨주는 BEP!)', '10) 단체상해보험 가입(본인, 배우자, 자녀, 양가 부모님 포함)', '11) 명절 효도비 지급', '12) 점심 식대 지원(법인카드)', '13) 크루들의 능력과 노력으로 회사가 돈을 벌었다면 그에 대한 합당한 보상이 주어집니다. 매년 영업이익의 일정 % 크루에게 배분', '14) 무엇보다 최고의 복지는? 일 잘하고 따듯한 우리의 BEP 동료들!', '', '이 외에도 크고 작은 다양한 복지 및 기업문화들이 기다리고 있습니다.', '관련하여 더 궁금하시다면 Water 홈페이지와 BEP블로그를 참고해주세요.', '', '서류 접수 및 평가 후 개별 면접을 진행하므로, 채용 기간은 조기 종료될 수 있습니다.']",100만원
256729,재무기획팀 회계 담당(Senior),더즌(dozn),"['본사/자회사 마감 및 결산 업무 (월/분기/반기/연 단위)', '본사 손익 분석 및 계정 명세서 검토(월 단위)', '회계감사 대응 (IFRS 기준 별도 정산표 및 재무제표·주석 작성)', '부가세, 법인세 등 세무 관련 업무']","['회계 관련 경력을 최소 7년 이상 보유하신 분(시니어급)', '경영 또는 회계를 전공하신 분', '회계감사 대응 경험이 있으신 분']","['상장사 재직 경험이 있으신 분', '현실에 안주하지 않고 커리어 향상을 목표로 노력하시는 분', '문제 해결에 적극적인 자세로 임하며, 포기하지 않고 끈기 있게 노력하여 해결해내는 분', '본인 업무에 대하여 책임감을 가지고 업무의 시작부터 끝까지 잘 파악하고 정리할 수 있는 분']","['더즌인의 특권!', '집중근무 일 7시간 / 주 35시간', '신논현역 초인접! 전망좋은 교보타워 오피스', '여유로운 점심시간 1시간 30분', '자유롭게 사용하는 개인 법인카드 지급', '장비 구매비용 지원', '교육비/도서비/취미활동비/체력단련운동비 지원', '다양한 간식 무제한 제공', '', '눈치보지 않고 떠나는 27일의 휴가', '입사와 동시에 연차 사용 가능', '연차 외 추가 유급 Refresh 휴가 12일', '근속 매 4년 마다 15일의 유급 휴가', '장기근속 휴가비 지급', '결혼 축하휴가 2주', '근로자 휴가지원사업', '', '\u200d\u200d\u200d가화만사성', '매년 직원 종합 건강검진 제공', '행복한 생일, 백화점 상품권 지급', '경조휴가 및 경조사비 지원', '새로운 가족의 탄생을 축하하는 출산휴가/육아휴직 지원', '명절 선물 제공', '사내 휴양리조트 운영', '', '그 외에도,', '아침 식사, 저녁식대 지원', '워크샵 지원', '팀회식비 지원', '사내동호회', '인재 추천 지원금', '편하게 쉴 수 있는 사내 휴식 라운지', '반바지도 샌들도 OK! 자율 복장', '', '#설립4~9년 #리프레시휴가 #주35시간']",100만원
253498,재무/회계 담당자 (3년 이상),미밍,"['회계, 재무, 세무 관련 전반적인 실무처리', '상품매출원가 계상', '부가세 원천세 신고', '자금흐름 관리', '자금 집행 및 스케줄 관리', '재무 관련 위험 관리', '매출 및 비용 내역에 대한 재무 분석을 실시 및 손익 분석 진행', '기타 행정 업무']","['학력: 초대졸/ 3년차 이상', '자체기장 가능', '월 결산 경험 있는 분', '회계전산시스템 도입경험 있는 분', '부가세 원천세 신고 가능한 분', '엑셀 활용 능력 우수하신 분', '주도적으로 이슈를 발굴하고, 문제 해결하는 과정을 즐기시는 분']","['-세무사무실 1년 이상 경험자', '-뷰티, 건강기능식품, 라이프스타일 커머스 관심많으신 분', '-빠르게 성장한 조직에서의 growth 경험이 있는 분', '-좁게 보기 보다 넓게 보고 맥락을 이해하기를 즐기시는 분', '-책임감 있는 태도를 가지신 분', '-임직원에 대한 배려와 원활한 커뮤니케이션 역량을 보유하신 분']","['- 매주 금요일 자율 출,퇴근제', '-풍성한 명절 선물', '-아낌 없는 경조사 지원', '-자사 상품 할인 구매 혜택', '-리프레시 휴가', '-확실한 보상 제도']",100만원
